{
  "$schema": "../schemas/agent-candidates.schema.json",
  "manifestVersion": 1,
  "owner": "simplexidev/sdeveng",
  "asOf": "2026-09-23",
  "detectedSystem": {
    "cliVersion": "0.155.1",
    "multiAgentFeature": "enabled",
    "multiAgentV2Feature": "disabled",
    "roleSelectionInActiveSpawnSurface": false,
    "customRoleFileParsing": "accepted",
    "customRoleDirectory": "$CODEX_HOME/agents/*.toml",
    "concurrencySetting": "templates/project/.codex/config.toml sets agents.max_concurrent_threads_per_session = 3",
    "notes": [
      "The active spawn surface accepts task, context-forking, model and reasoning overrides but no role selector.",
      "The installed prompt describes subagents as equal-capability contexts sharing the filesystem and tool surface.",
      "Custom role TOML parsed without a malformed-role warning in an isolated temporary Codex home.",
      "The built-in explorer comparator must be feature-gated because it is not exposed by the detected runtime surface."
    ]
  },
  "policy": {
    "hierarchy": ["deterministic", "jev", "agent", "stronger-agent"],
    "productionChanges": "none",
    "runtimeDefaultExclusions": ["eval-judge"],
    "delegation": "root-only; delegated agents must not delegate",
    "decisionVocabulary": ["KEEP", "MODIFY", "RETIRE", "REPLACE_WITH_BUILTIN", "EVALUATE_FOR_ADD", "INSUFFICIENT_EVIDENCE"]
  },
  "evidence": [
    {
      "id": "cli-version",
      "kind": "installed-cli",
      "locator": "codex --version",
      "supports": ["Codex CLI version 0.155.1 was audited."]
    },
    {
      "id": "cli-features",
      "kind": "installed-cli",
      "locator": "codex features list",
      "supports": ["multi_agent is stable and enabled.", "multi_agent_v2 is stable and disabled."]
    },
    {
      "id": "active-spawn-surface",
      "kind": "runtime-surface",
      "locator": "spawn_agent tool schema and codex debug prompt-input",
      "supports": ["No role or agent_type selector is exposed.", "Subagents inherit or explicitly override model and reasoning.", "Subagents share the workspace and available tools."]
    },
    {
      "id": "custom-role-parse",
      "kind": "installed-cli",
      "locator": "isolated CODEX_HOME app-server startup with agents/reviewer.toml",
      "supports": ["The current reviewer TOML shape is accepted by the installed parser."]
    },
    {
      "id": "reviewer-source",
      "kind": "repository",
      "locator": "agents/reviewer.toml",
      "supports": ["Reviewer model, reasoning, read-only sandbox, purpose and instructions."]
    },
    {
      "id": "installer-source",
      "kind": "repository",
      "locator": "tools/AgentTool.cs:Installer.Plan",
      "supports": ["Toolkit agent TOML files are linked into the Codex agent directory."]
    },
    {
      "id": "capability-source",
      "kind": "repository",
      "locator": "config/capabilities.json",
      "supports": ["Deterministic-first routing, current skill/tool overlap and review activation policy."]
    },
    {
      "id": "retired-role-source",
      "kind": "git-history",
      "locator": "commit 2a5c0700cb9f42ef7d9c75ab5ffdc9447b9bce55",
      "supports": ["code-mapper and log-analyzer were removed during routing simplification.", "Their last model, sandbox and instruction contracts remain auditable."]
    },
    {
      "id": "official-multi-agent",
      "kind": "official-docs",
      "locator": "https://developers.openai.com/api/docs/guides/agents-api/multi-agent",
      "supports": ["Subagents have separate contexts.", "Subagents inherit configured tools and share the environment filesystem.", "Delegation is intended for independent bounded work."]
    },
    {
      "id": "agent-capability-evaluation-2026-09-23",
      "kind": "metrics",
      "locator": "https://simplexidev.github.io/sdeveng-metrics-dashboard/data/public/agent-capability-evaluation.json",
      "supports": ["The current reviewer matched generic quality on the bounded security diff.", "The historical code mapper underperformed generic bounded delegation.", "The broad historical log analyzer and every proposed specialist had no measured quality advantage sufficient for a persistent custom role."]
    }
  ],
  "builtInRoles": [
    {
      "id": "root-coordinator",
      "class": "built-in",
      "lifecycle": "current",
      "availability": "available",
      "purpose": "Own the user task, decide whether bounded delegation is justified, and synthesize subagent results.",
      "disposition": "KEEP",
      "rationale": "This is the required orchestration role and avoids a separate toolkit coordinator.",
      "evidence": ["active-spawn-surface", "official-multi-agent"],
      "model": { "name": "session-selected", "reasoning": "session-selected", "source": "inherits-parent" },
      "staticCost": { "trigger": "session-root", "metadata": "none", "invocation": "none", "contextIsolation": "none" },
      "capabilities": { "sandbox": "session policy", "tools": ["all session tools"], "mcp": ["configured session MCP"], "skills": ["task-triggered installed skills"] },
      "interface": {
        "callers": ["user"],
        "inputs": ["user request", "workspace instructions", "tool and skill metadata"],
        "outputs": ["completed result", "bounded delegated tasks", "synthesized evidence"]
      },
      "overlap": ["All candidate roles are narrower slices of root reasoning."],
      "isolationValue": "None itself; it benefits when a delegated context prevents broad evidence from displacing task state."
    },
    {
      "id": "generic-subagent",
      "class": "built-in",
      "lifecycle": "current",
      "availability": "available",
      "purpose": "Perform an independently scoped task in a separate context with the shared filesystem and inherited capabilities.",
      "disposition": "KEEP",
      "rationale": "It is the only role selectable through the detected spawn surface and is the mandatory baseline for specialist evaluations.",
      "evidence": ["active-spawn-surface", "official-multi-agent"],
      "model": { "name": "parent by default", "reasoning": "parent by default", "source": "inherits-parent" },
      "staticCost": { "trigger": "explicit-delegation", "metadata": "low", "invocation": "separate-model-turn", "contextIsolation": "high" },
      "capabilities": { "sandbox": "inherited session policy", "tools": ["inherited session tools"], "mcp": ["inherited configured MCP"], "skills": ["task-triggered installed skills"] },
      "interface": {
        "callers": ["root coordinator"],
        "inputs": ["bounded task message", "selected conversation turns", "shared workspace state"],
        "outputs": ["concise findings or bounded edits", "paths changed when editing", "unresolved evidence gaps", "no delegated tasks"]
      },
      "overlap": ["Can perform every proposed specialist task when given a precise task message."],
      "isolationValue": "High for independent evidence collection; specialization must beat this generic baseline after accounting for added routing metadata."
    },
    {
      "id": "built-in-explorer",
      "class": "built-in",
      "lifecycle": "conditional-comparator",
      "availability": "not-exposed",
      "purpose": "Potential native read-only repository exploration comparator requested by the roadmap.",
      "disposition": "INSUFFICIENT_EVIDENCE",
      "rationale": "Neither the active spawn schema nor official documentation inspected for this audit exposes a selectable explorer role; metrics must skip rather than silently substitute it.",
      "evidence": ["active-spawn-surface", "official-multi-agent"],
      "model": { "name": "unknown", "reasoning": "unknown", "source": "candidate" },
      "staticCost": { "trigger": "conditional", "metadata": "unknown", "invocation": "unknown", "contextIsolation": "unknown" },
      "capabilities": { "sandbox": "unknown", "tools": ["unknown"], "mcp": ["unknown"], "skills": ["unknown"] },
      "interface": {
        "callers": ["root coordinator if a future runtime exposes the role"],
        "inputs": ["feature-detected native role contract"],
        "outputs": ["repository map if supported"]
      },
      "overlap": ["historical code-mapper", "generic-subagent repository exploration"],
      "isolationValue": "Potentially high, but unmeasurable until the role is actually exposed and its contract can be recorded."
    }
  ],
  "toolkitRoles": [
    {
      "id": "reviewer",
      "class": "toolkit-custom",
      "lifecycle": "current",
      "availability": "repository-only",
      "purpose": "Independently review an explicitly requested or substantial high-risk completed diff for actionable defects.",
      "disposition": "KEEP",
      "rationale": "Its read-only boundary, high-risk trigger and independent context are distinct from post-review comment handling; the bounded evaluation matched generic security-review quality, so retain the established reviewer rather than add a narrower duplicate.",
      "evidence": ["reviewer-source", "installer-source", "capability-source", "agent-capability-evaluation-2026-09-23"],
      "model": { "name": "gpt-5.6-terra", "reasoning": "high", "source": "fixed" },
      "staticCost": { "trigger": "explicit-or-high-risk", "metadata": "low", "invocation": "separate-model-turn", "contextIsolation": "high" },
      "capabilities": { "sandbox": "read-only", "tools": ["inherited tools; deterministic checks preferred"], "mcp": ["inherited configured MCP; no role-specific MCP"], "skills": ["task-triggered skills; address-pr-review is post-review rather than automatic input"] },
      "interface": {
        "callers": ["root coordinator after a completed diff"],
        "inputs": ["explicit review request or high-risk completion", "actual diff", "direct dependencies", "relevant validation evidence"],
        "outputs": ["prioritized actionable findings", "triggering conditions", "file and line evidence", "explicit no-findings result"]
      },